<?xml version="1.0" encoding="UTF-8"?>
<p:certificateDefinitions xmlns:p="http://www.secunet.com"
	xmlns:xsi="http://www.w3.org/2001/XMLSchema-instance"
	xsi:schemaLocation="http://www.secunet.com tls_schema.xsd ">
	<p:certificateDefinition>
		<p:name>CERT_ECARD_CSCA_1</p:name>
		<p:serialNumber>1</p:serialNumber>
		<p:keyAlgorithm>
			<p:ECDSA>brainpoolP384r1</p:ECDSA>
		</p:keyAlgorithm>
		<p:signatureAlgorithm>
			<p:ECDSA>SHA384withECDSA</p:ECDSA>
		</p:signatureAlgorithm>
		<p:issuer>
			<p:organization>bund</p:organization>
			<p:organizationalUnit>bsi</p:organizationalUnit>
			<p:country>DE</p:country>
			<p:commonName>eID-Server Testbed CSCA</p:commonName>
		</p:issuer>
		<p:subject>
			<p:organization>bund</p:organization>
			<p:organizationalUnit>bsi</p:organizationalUnit>
			<p:country>DE</p:country>
			<p:commonName>eID-Server Testbed CSCA</p:commonName>
		</p:subject>
		<p:extensions>
			<p:keyUsage>
				<p:cRLSign>true</p:cRLSign>
				<p:keyCertSign>true</p:keyCertSign>
				<p:digitalSignature>true</p:digitalSignature>
				<p:keyAgreement>true</p:keyAgreement>
			</p:keyUsage>
			<p:basicConstraints>
				<p:cA>true</p:cA>
			</p:basicConstraints>
		</p:extensions>
	</p:certificateDefinition>
	<p:certificateDefinition>
		<p:name>CERT_ECARD_DS_1_A</p:name>
		<p:serialNumber>101</p:serialNumber>
		<p:keyAlgorithm>
			<p:ECDSA>brainpoolP384r1</p:ECDSA>
		</p:keyAlgorithm>
		<p:signatureAlgorithm>
			<p:ECDSA>SHA384withECDSA</p:ECDSA>
		</p:signatureAlgorithm>
		<p:issuer>
			<p:organization>bund</p:organization>
			<p:organizationalUnit>bsi</p:organizationalUnit>
			<p:country>DE</p:country>
			<p:commonName>eID-Server Testbed CSCA</p:commonName>
		</p:issuer>
		<p:subject>
			<p:organization>bund</p:organization>
			<p:organizationalUnit>bsi</p:organizationalUnit>
			<p:country>DE</p:country>
			<p:commonName>eID-Server Testbed DS 1 A</p:commonName>
		</p:subject>
		<p:extensions>
			<p:keyUsage>
				<p:cRLSign>true</p:cRLSign>
				<p:keyCertSign>true</p:keyCertSign>
				<p:digitalSignature>true</p:digitalSignature>
				<p:keyAgreement>true</p:keyAgreement>
			</p:keyUsage>
			<p:basicConstraints>
				<p:cA>false</p:cA>
			</p:basicConstraints>
		</p:extensions>
	</p:certificateDefinition>
	<p:certificateDefinition>
		<p:name>CERT_ECARD_DS_1_B</p:name>
		<p:serialNumber>102</p:serialNumber>
		<p:keyAlgorithm>
			<p:ECDSA>brainpoolP384r1</p:ECDSA>
		</p:keyAlgorithm>
		<p:signatureAlgorithm>
			<p:ECDSA>SHA384withECDSA</p:ECDSA>
		</p:signatureAlgorithm>
		<p:issuer>
			<p:organization>bund</p:organization>
			<p:organizationalUnit>bsi</p:organizationalUnit>
			<p:country>DE</p:country>
			<p:commonName>eID-Server Testbed CSCA</p:commonName>
		</p:issuer>
		<p:subject>
			<p:organization>bund</p:organization>
			<p:organizationalUnit>bsi</p:organizationalUnit>
			<p:country>DE</p:country>
			<p:commonName>eID-Server Testbed DS 1 B</p:commonName>
		</p:subject>
		<p:extensions>
			<p:keyUsage>
				<p:cRLSign>true</p:cRLSign>
				<p:keyCertSign>true</p:keyCertSign>
				<p:digitalSignature>true</p:digitalSignature>
				<p:keyAgreement>true</p:keyAgreement>
			</p:keyUsage>
			<p:basicConstraints>
				<p:cA>false</p:cA>
			</p:basicConstraints>
		</p:extensions>
	</p:certificateDefinition>
	<p:certificateDefinition>
		<p:name>CERT_ECARD_CSCA_1_MASTERLIST_SIGNER</p:name>
		<p:serialNumber>11</p:serialNumber>
		<p:keyAlgorithm>
			<p:ECDSA>brainpoolP384r1</p:ECDSA>
		</p:keyAlgorithm>
		<p:signatureAlgorithm>
			<p:ECDSA>SHA384withECDSA</p:ECDSA>
		</p:signatureAlgorithm>
		<p:issuer>
			<p:organization>bund</p:organization>
			<p:organizationalUnit>bsi</p:organizationalUnit>
			<p:country>DE</p:country>
			<p:commonName>eID-Server Testbed CSCA</p:commonName>
		</p:issuer>
		<p:subject>
			<p:organization>bund</p:organization>
			<p:organizationalUnit>bsi</p:organizationalUnit>
			<p:country>DE</p:country>
			<p:commonName>eID-Server Testbed Master List Signer</p:commonName>
		</p:subject>
		<p:extensions>
			<p:keyUsage>
				<p:digitalSignature>true</p:digitalSignature>
			</p:keyUsage>
			<p:basicConstraints>
				<p:cA>false</p:cA>
			</p:basicConstraints>
		</p:extensions>
	</p:certificateDefinition>
	<p:certificateDefinition>
		<p:name>CERT_ECARD_CSCA_1_DEFECTLIST_SIGNER</p:name>
		<p:serialNumber>21</p:serialNumber>
		<p:keyAlgorithm>
			<p:ECDSA>brainpoolP384r1</p:ECDSA>
		</p:keyAlgorithm>
		<p:signatureAlgorithm>
			<p:ECDSA>SHA384withECDSA</p:ECDSA>
		</p:signatureAlgorithm>
		<p:issuer>
			<p:organization>bund</p:organization>
			<p:organizationalUnit>bsi</p:organizationalUnit>
			<p:country>DE</p:country>
			<p:commonName>eID-Server Testbed CSCA</p:commonName>
		</p:issuer>
		<p:subject>
			<p:organization>bund</p:organization>
			<p:organizationalUnit>bsi</p:organizationalUnit>
			<p:country>DE</p:country>
			<p:commonName>eID-Server Testbed Defect List Signer</p:commonName>
		</p:subject>
		<p:extensions>
			<p:keyUsage>
				<p:digitalSignature>true</p:digitalSignature>
			</p:keyUsage>
			<p:basicConstraints>
				<p:cA>false</p:cA>
			</p:basicConstraints>
		</p:extensions>
	</p:certificateDefinition>
	<p:certificateDefinition>
		<p:name>CERT_ECARD_CSCA_1_BLACKLIST_SIGNER</p:name>
		<p:serialNumber>31</p:serialNumber>
		<p:keyAlgorithm>
			<p:ECDSA>brainpoolP384r1</p:ECDSA>
		</p:keyAlgorithm>
		<p:signatureAlgorithm>
			<p:ECDSA>SHA384withECDSA</p:ECDSA>
		</p:signatureAlgorithm>
		<p:issuer>
			<p:organization>bund</p:organization>
			<p:organizationalUnit>bsi</p:organizationalUnit>
			<p:country>DE</p:country>
			<p:commonName>eID-Server Testbed CSCA</p:commonName>
		</p:issuer>
		<p:subject>
			<p:organization>bund</p:organization>
			<p:organizationalUnit>bsi</p:organizationalUnit>
			<p:country>DE</p:country>
			<p:commonName>eID-Server Testbed Black List Signer</p:commonName>
		</p:subject>
		<p:extensions>
			<p:keyUsage>
				<p:digitalSignature>true</p:digitalSignature>
			</p:keyUsage>
			<p:basicConstraints>
				<p:cA>false</p:cA>
			</p:basicConstraints>
		</p:extensions>
	</p:certificateDefinition>
</p:certificateDefinitions>
