<?xml version="1.0" encoding="UTF-8"?>
<p:certificateDefinitions xmlns:p="http://www.secunet.com"
	xmlns:xsi="http://www.w3.org/2001/XMLSchema-instance"
	xsi:schemaLocation="http://www.secunet.com ../tls_schema.xsd ">
	<p:certificateDefinition>									<!-- CA certificate -->
		<p:name>SAMPLE_CERTIFICATE_1</p:name>
		<p:keyAlgorithm>
			<p:ECDSA>sect283k1</p:ECDSA>
		</p:keyAlgorithm>
		<p:issuer>
			<p:organization>secunet AG</p:organization>
			<p:organizationalUnit>Homeland Security</p:organizationalUnit>
			<p:country>DE</p:country>
			<p:commonName>secunet CA</p:commonName>
		</p:issuer>
		<p:subject>
			<p:organization>secunet AG</p:organization>
			<p:organizationalUnit>Homeland Security</p:organizationalUnit>
			<p:country>DE</p:country>
			<p:commonName>Testbed</p:commonName>
		</p:subject>
		<p:extensions>
			<p:keyUsage>
				<p:cRLSign>true</p:cRLSign>
				<p:keyCertSign>true</p:keyCertSign>
				<p:digitalSignature>true</p:digitalSignature>
				<p:keyAgreement>true</p:keyAgreement>
			</p:keyUsage>
			<p:basicConstraints>
				<p:cA>true</p:cA>
			</p:basicConstraints>
			<p:extendedKeyUsage>
				<p:serverAuth>true</p:serverAuth>
			</p:extendedKeyUsage>
			<p:subjectAltName>
				<p:GeneralName type="dNSName">ausweisapp-idp-test.secunet.de</p:GeneralName>
			</p:subjectAltName>
		</p:extensions>
	</p:certificateDefinition>
	<p:certificateDefinition>								<!-- Some other child certificate TODO name me! -->
		<p:name>SAMPLE_CERTIFICATE_2</p:name>
		<p:serialNumber>112</p:serialNumber>
		<p:keyAlgorithm>
			<p:RSA>4096</p:RSA>
		</p:keyAlgorithm>
		<p:signatureAlgorithm>
			<p:ECDSA>SHA512withECDSA</p:ECDSA>
		</p:signatureAlgorithm>
		<p:issuer>
			<p:organization>secunet AG</p:organization>
			<p:organizationalUnit>Homeland Security</p:organizationalUnit>
			<p:country>DE</p:country>
			<p:commonName>secunet CA</p:commonName>
		</p:issuer>
		<p:subject>
			<p:organization>secunet AG</p:organization>
			<p:organizationalUnit>Homeland Security</p:organizationalUnit>
			<p:country>DE</p:country>
			<p:commonName>Testbed</p:commonName>
		</p:subject>
	</p:certificateDefinition>
</p:certificateDefinitions>
